chunk_id,question,answer,n_sentences,sentences,sentences_join
03-Prospecto-Gadopril#0000,¿Qué forma de comprimido tiene el medicamento GADOPRIL?,Comprimidos ranurados,3,"['Comprimidos ranurados', 'Cada comprimido ranurado de GADOPRIL® 2,5 contiene: Enalapril maleato ......................................................................................2,50 mg', 'Cada comprimido ranurado de GADOPRIL® 5 contiene: Enalapril maleato ......................................................................................5,00 mg']","Comprimidos ranurados || Cada comprimido ranurado de GADOPRIL® 2,5 contiene: Enalapril maleato ......................................................................................2,50 mg || Cada comprimido ranurado de GADOPRIL® 5 contiene: Enalapril maleato ......................................................................................5,00 mg"
03-Prospecto-Gadopril#0015,¿Qué efecto tiene Gadopril en la degradación de bradicinina?,Gadopril puede bloquear la degradación de bradicinina.,1,"['Gadopril® también puede bloquear la degradación de bradicinina, un potente péptido vasodepresor.']","Gadopril® también puede bloquear la degradación de bradicinina, un potente péptido vasodepresor."
03-Prospecto-Gadopril#0045,¿Qué efecto tiene enalapril sobre la presión arterial en pacientes de raza negra?,"Aparentemente, enalapril es menos efectivo disminuyendo la presión arterial en pacientes de raza negra.",1,"['Como sucede con otros inhibidores de la enzima de conversión de angiotensina, aparentemente, enalapril es menos efectivo disminuyendo la presión arterial en pacientes de raza negra que en pacientes que no sean de raza negra, posiblemente debido a una mayor prevalencia de situaciones de niveles bajos de renina en los pacientes hipertensos de raza negra.']","Como sucede con otros inhibidores de la enzima de conversión de angiotensina, aparentemente, enalapril es menos efectivo disminuyendo la presión arterial en pacientes de raza negra que en pacientes que no sean de raza negra, posiblemente debido a una mayor prevalencia de situaciones de niveles bajos de renina en los pacientes hipertensos de raza negra."
Aclusin__D1584-E-1324-01-Instrucci_n-Aclusin#0060,¿Cuál medicamento debe usarse con precaución en pacientes con insuficiencia hepática severa?,Cilostazol,2,"['en pacientes con insuficiencia hepática o renal severas.', 'Inhibidores del citocromo P450; si bien no se han descripto interacciones específicas, cilostazol deberá administrarse con precaución en pacientes que toman simultáneamente inhibidores de amplio espectro del citocromo P450, tales como ketoconazol, eritromicina, fluoxetina, etc.']","en pacientes con insuficiencia hepática o renal severas. || Inhibidores del citocromo P450; si bien no se han descripto interacciones específicas, cilostazol deberá administrarse con precaución en pacientes que toman simultáneamente inhibidores de amplio espectro del citocromo P450, tales como ketoconazol, eritromicina, fluoxetina, etc."
Activil_Comp._Mast.__D0389-E-0929-02-Instrucci_n-Activil-Masticables#0075,¿Qué efecto puede tener el Sildenafil en pacientes con enfermedad cardiovascular?,El Sildenafil puede afectar adversamente a pacientes con enfermedad cardiovascular debido a su efecto vasodilatador sistémico que produce disminución transitoria de la presión arterial.,6,"['Sildenafil tiene efecto vasodilatador sistémico que produce disminución transitoria de la presión arterial.', 'Este efecto, de escasas consecuencias en la mayoría de los pacientes en condiciones normales, puede afectar adversamente a pacientes con enfermedad cardiovascular, más aún si la vasodilatación provocada se combina con actividad sexual.', 'Pacientes no estudiados en ensayos clínicos:  no  existen  datos  de  ensayos  clínicos controlados  que indiquen  la seguridad o eficacia del Sildenafil  en los  siguientes  grupos  de pacientes, por lo que en caso de ser prescripto, deben serlo con extrema precaución:', 'a) pacientes que hayan sufrido infarto de miocardio, accidente cerebrovascular o arritmia severa en los últimos 6 meses.', 'b) Pacientes con hipotensión (presión arterial <90/50 m o hipertensión arterial >170/100).', 'c) Pacientes con historia de insuficiencia cardíaca o enfermedad coronaria causal de angina inestable.']","Sildenafil tiene efecto vasodilatador sistémico que produce disminución transitoria de la presión arterial. || Este efecto, de escasas consecuencias en la mayoría de los pacientes en condiciones normales, puede afectar adversamente a pacientes con enfermedad cardiovascular, más aún si la vasodilatación provocada se combina con actividad sexual. || Pacientes no estudiados en ensayos clínicos:  no  existen  datos  de  ensayos  clínicos controlados  que indiquen  la seguridad o eficacia del Sildenafil  en los  siguientes  grupos  de pacientes, por lo que en caso de ser prescripto, deben serlo con extrema precaución: || a) pacientes que hayan sufrido infarto de miocardio, accidente cerebrovascular o arritmia severa en los últimos 6 meses. || b) Pacientes con hipotensión (presión arterial <90/50 m o hipertensión arterial >170/100). || c) Pacientes con historia de insuficiencia cardíaca o enfermedad coronaria causal de angina inestable."
Albicar__D1805-E-1517-02-Instrucci_n-Albicar#0090,¿Cuál es la dosis inicial recomendada de Solución Bebible Adultos para un sujeto de 50 kg?,1 g/día,1,"['La dosis recomendada es de 1 a 3 g/día (10-30 ml/día) para un sujeto de 50 kg, con una dosis inicial de 1 g/día, incrementándose lentamente según tolerancia y respuesta.']","La dosis recomendada es de 1 a 3 g/día (10-30 ml/día) para un sujeto de 50 kg, con una dosis inicial de 1 g/día, incrementándose lentamente según tolerancia y respuesta."
Alercas_60__D0186-E-0757-02-Instruccion-Alercas-60#0105,¿Cuál es la edad mínima para el uso seguro de fexofenadina en niños?,12 años de edad,1,['La seguridad y eficacia de la fexofenadina no ha sido establecida en pacientes pediátricos menores de l2 años de edad.'],La seguridad y eficacia de la fexofenadina no ha sido establecida en pacientes pediátricos menores de l2 años de edad.
Alercas_D__D2913-E-2587-01-Instruccion-Alercas-D#0120,¿Cuál es la acción presora de la pseudoefedrina en adultos normotensos?,Leve o nula,2,"['En la dosis oral recomendada la acción presora en adultos normotensos es leve o nula.', 'Puede inducir efectos colaterales excitatorios.']",En la dosis oral recomendada la acción presora en adultos normotensos es leve o nula. || Puede inducir efectos colaterales excitatorios.
Algicur__D2737-E-2415-01-Instruccion-Algicur#0135,¿Qué tipo de reacciones adversas se observan con mayor frecuencia en pacientes que toman este medicamento?,Las reacciones adversas que se observan con mayor frecuencia son de naturaleza gastrointestinal.,3,"['Las reacciones adversas que se observan con mayor frecuencia son de naturaleza gastrointestinal.', 'Tras la administración, se han comunicado casos de náuseas, vómitos, diarrea, flatulencia, estreñimiento, dispepsia, dolor abdominal, melenas, hematemesis, estomatitis ulcerativa, exacerbación de colitis y enfermedad de Crohn.', 'Pueden aparecer úlceras pépticas, perforaciones o hemorragias gastrointestinales, especialmente en ancianos.']","Las reacciones adversas que se observan con mayor frecuencia son de naturaleza gastrointestinal. || Tras la administración, se han comunicado casos de náuseas, vómitos, diarrea, flatulencia, estreñimiento, dispepsia, dolor abdominal, melenas, hematemesis, estomatitis ulcerativa, exacerbación de colitis y enfermedad de Crohn. || Pueden aparecer úlceras pépticas, perforaciones o hemorragias gastrointestinales, especialmente en ancianos."
Amoclav_Duo_Suspensi_n__D0290-E-0854-05-Instruccion-Amoclav-Duo-Suspension-1#0150,¿Qué tipo de infecciones pueden ser tratadas con AMOCLAV DUO?,"Infecciones del tracto respiratorio inferior, otitis media, sinusitis, infecciones dermatológicas y infecciones del tracto urinario causadas por gérmenes sensibles a ampicilina o productores de ß-lactamasas.",6,"['AMOCLAV® DUO está indicado en el tratamiento de infecciones causadas por cepas sensibles de los gérmenes abajo descriptos para las siguientes patologías:', '-  Infecciones del tracto respiratorio inferior: causadas por cepas productoras de ß-lactamasas de Haemophilus influenzae y Moraxela (Branhamella) catarrhalis.', '-  Otitis media: causadas por cepas productoras de ß-lactamasas de Haemophilus influenzae y Moraxela (Branhamella)catarrhalis.', '- Sinusitis: causadas por cepas productoras de ß-lactamasas de Haemophilus influenzae y Moraxela (Branhamella) catarrhalis.', '-  Infecciones dermatológicas: causadas por cepas productoras de ß-lactamasas de Staphilococcus aureus, Escherichia coli y    Klebsiella spp.', '-  Infecciones del tracto urinario: causadas por cepas productoras de ß-lactamasas de Escherichia coli, Enterobacter spp. y Klebsiella spp.']","AMOCLAV® DUO está indicado en el tratamiento de infecciones causadas por cepas sensibles de los gérmenes abajo descriptos para las siguientes patologías: || -  Infecciones del tracto respiratorio inferior: causadas por cepas productoras de ß-lactamasas de Haemophilus influenzae y Moraxela (Branhamella) catarrhalis. || -  Otitis media: causadas por cepas productoras de ß-lactamasas de Haemophilus influenzae y Moraxela (Branhamella)catarrhalis. || - Sinusitis: causadas por cepas productoras de ß-lactamasas de Haemophilus influenzae y Moraxela (Branhamella) catarrhalis. || -  Infecciones dermatológicas: causadas por cepas productoras de ß-lactamasas de Staphilococcus aureus, Escherichia coli y    Klebsiella spp. || -  Infecciones del tracto urinario: causadas por cepas productoras de ß-lactamasas de Escherichia coli, Enterobacter spp. y Klebsiella spp."
Amoclav_Duo__D0285-E-0850-05-Instrucci_n-Amoclav-Duo-Comprimidos-1#0165,¿Cuál medicamento debe evitarse al administrar AMOCLAV DUO?,Disulfiran,1,['No se sabe si el incremento de esta incidencia es debido a la asociación o a la presencia de hiperuricemia en estos pacientes. No existen datos acerca del efecto de la administración simultánea de AMOCLAV DUO y Allopurinol. AMOCLAV DUO no debe ser administrado concomitantemente con Disulfiran.'],No se sabe si el incremento de esta incidencia es debido a la asociación o a la presencia de hiperuricemia en estos pacientes. No existen datos acerca del efecto de la administración simultánea de AMOCLAV DUO y Allopurinol. AMOCLAV DUO no debe ser administrado concomitantemente con Disulfiran.
Amoclav_SE__MKG-Instruccion-Amoclav-SE#0180,¿Cuál es el medicamento que se recomienda administrar con precaución en pacientes con disfunción hepática?,AMOCLAV SE,2,"['Se recomienda administrar AMOCLAV SE con precaución en pacientes que presenten evidencia de disfunción hepática.', 'La toxicidad hepática asociada con el uso de amoxicilina/clavulanato de potasio es generalmente reversible. En raras ocasiones, se han reportado muertes (menos de 1 muerte por cada 4 millones estimados de prescripciones a nivel mundial). Estos han sido casos asociados con enfermedades subyacentes serias o medicaciones concomitantes (ver Contraindicaciones y Reacciones Adversas – Hígado).']","Se recomienda administrar AMOCLAV SE con precaución en pacientes que presenten evidencia de disfunción hepática. || La toxicidad hepática asociada con el uso de amoxicilina/clavulanato de potasio es generalmente reversible. En raras ocasiones, se han reportado muertes (menos de 1 muerte por cada 4 millones estimados de prescripciones a nivel mundial). Estos han sido casos asociados con enfermedades subyacentes serias o medicaciones concomitantes (ver Contraindicaciones y Reacciones Adversas – Hígado)."
Ampliar_80__Instruccion-Ampliar-80-180x600-web#0210,¿Qué es la función principal de la HMG-CoA reductasa en el cuerpo?,"La HMG-CoA reductasa es la enzima que limita la velocidad de conversión de 3-hidroxi-3-metilglutaril-Coenzima A en mevalonato, un precursor de los esteroles, incluido el colesterol.",2,"['La HMG-CoA reductasa es la enzima que limita la velocidad de conversación de 3-hidroxi-3-metilglutaril-Coenzima A en mevalonato, un precursor de los esteroles, incluido el colesterol.', 'Atorvastatina cálcica es un inhibidor competitivo y selectivo de la HMG-CoA reductasa.']","La HMG-CoA reductasa es la enzima que limita la velocidad de conversación de 3-hidroxi-3-metilglutaril-Coenzima A en mevalonato, un precursor de los esteroles, incluido el colesterol. || Atorvastatina cálcica es un inhibidor competitivo y selectivo de la HMG-CoA reductasa."
Ampliar_80__Instruccion-Ampliar-80-180x600-web#0225,¿Cuál es la importancia clínica de la interacción con otras drogas?,No se especifica la importancia clínica de la interacción con otras drogas.,7,"['La demora en la administración de atorvastatina luego de la administración de rifampicina se ha asociado a una reducción significativa de las concentraciones plasmáticas de atorvastatina.', 'Se debe tener precaución y utilizar la dosis más baja necesaria.', 'En pacientes con VIH que toman lopinavir más ritonavir se debe tener cuidado al recetar atorvastatina cálcica y se debe emplear la dosis más baja necesaria.', 'El tratamiento con atorvastatina cálcica debe limitarse a 20 mg y se recomienda realizar las evaluaciones clínicas apropiadas para garantizar el uso de la dosis más baja necesaria de atorvastatina cálcica.', 'En pacientes que toman claritromicina, itraconazol o en los pacientes con VIH que toman una combinación de saquinavir más ritonavir, darunavir más rinavir, fosmaprenavir o fosamprenavir más ritonavir, el tratamiento con atorvastatina cálcica debe limitarse a 20 mg y se recomienda realizar las evaluaciones clínicas apropiadas para garantizar el uso de la dosis más baja necesaria de atorvastatina cálcica.', 'En pacientes que toman el inhibidor de la proteasa del VIH, nelfinavir, o el inhibidor de la proteasa de la hepatitis C, boceprevir, el tratamiento con atorvastatina cálcica se debe limitar a 40 mg y se recomienda realizar las evaluaciones clínicas apropiadas para garantizar el uso de la dosis más baja necesaria de atorvastatina cálcica.', 'Se debe evitar el tratamiento con atorvastatina cálcica en pacientes que toman ciclosporina o inhibidores de la proteasa del VIH (tipranavir más ritonavir) o el inhibidor de la proteasa de la hepatitis C (telaprevir).']","La demora en la administración de atorvastatina luego de la administración de rifampicina se ha asociado a una reducción significativa de las concentraciones plasmáticas de atorvastatina. || Se debe tener precaución y utilizar la dosis más baja necesaria. || En pacientes con VIH que toman lopinavir más ritonavir se debe tener cuidado al recetar atorvastatina cálcica y se debe emplear la dosis más baja necesaria. || El tratamiento con atorvastatina cálcica debe limitarse a 20 mg y se recomienda realizar las evaluaciones clínicas apropiadas para garantizar el uso de la dosis más baja necesaria de atorvastatina cálcica. || En pacientes que toman claritromicina, itraconazol o en los pacientes con VIH que toman una combinación de saquinavir más ritonavir, darunavir más rinavir, fosmaprenavir o fosamprenavir más ritonavir, el tratamiento con atorvastatina cálcica debe limitarse a 20 mg y se recomienda realizar las evaluaciones clínicas apropiadas para garantizar el uso de la dosis más baja necesaria de atorvastatina cálcica. || En pacientes que toman el inhibidor de la proteasa del VIH, nelfinavir, o el inhibidor de la proteasa de la hepatitis C, boceprevir, el tratamiento con atorvastatina cálcica se debe limitar a 40 mg y se recomienda realizar las evaluaciones clínicas apropiadas para garantizar el uso de la dosis más baja necesaria de atorvastatina cálcica. || Se debe evitar el tratamiento con atorvastatina cálcica en pacientes que toman ciclosporina o inhibidores de la proteasa del VIH (tipranavir más ritonavir) o el inhibidor de la proteasa de la hepatitis C (telaprevir)."
Ampliar_80__Instruccion-Ampliar-80-180x600-web#0240,¿Cuántos comprimidos tiene cada envase?,30,1,['Envases con 30 comprimidos recubiertos.'],Envases con 30 comprimidos recubiertos.
Ampliar_Duo__D1443-E-0604-02-INSTRUCCION-AMPLIAR-DUO#0255,¿Cuál es la reacción adversa más común con ezetimibe en pacientes que reciben solo este medicamento?,cefalea,3,"['En los estudios clínicos ezetimibe fue habitualmente bien tolerado, siendo las reacciones adversas leves y transitorias.', 'La incidencia global de efectos secundarios observados con ezetimibe fue similar a la comunicada con placebo, lo mismo que la tasa de interrupción de tratamiento.', 'Las siguientes fueron las reacciones adversas más comunes (≥ 1 en 100/100, <1/10) vinculadas a la droga, en los pacientes que recibieron ezetimibe solo: cefalea, dolor abdominal y diarrea.']","En los estudios clínicos ezetimibe fue habitualmente bien tolerado, siendo las reacciones adversas leves y transitorias. || La incidencia global de efectos secundarios observados con ezetimibe fue similar a la comunicada con placebo, lo mismo que la tasa de interrupción de tratamiento. || Las siguientes fueron las reacciones adversas más comunes (≥ 1 en 100/100, <1/10) vinculadas a la droga, en los pacientes que recibieron ezetimibe solo: cefalea, dolor abdominal y diarrea."
Ampliar_Plus__D1461-E-1203-03-Instrucci_n-Ampliar-Plus#0270,¿Cuál es la dosis máxima recomendada de atorvastatina en humanos?,80 mg/kg/día,2,"['Estas dosis fueron de 6 a 11 veces (ratón) y 8 a 16 veces el AUC en humanos (0-24) basadas en la dosis máxima recomendada en humanos de 80 mg/día.', 'La dosis de 120 mg/kg/día resultó en una exposición sistémica de aproximadamente 16 veces el área por debajo de la curva 5 6 de plasma en humanos (AUC 0-24 horas) basada en la dosis máxima en humanos de 80 mg/kg/día.']",Estas dosis fueron de 6 a 11 veces (ratón) y 8 a 16 veces el AUC en humanos (0-24) basadas en la dosis máxima recomendada en humanos de 80 mg/día. || La dosis de 120 mg/kg/día resultó en una exposición sistémica de aproximadamente 16 veces el área por debajo de la curva 5 6 de plasma en humanos (AUC 0-24 horas) basada en la dosis máxima en humanos de 80 mg/kg/día.
Ampliar__D1174-E-0330-03-Instruccion-Ampliar-10-y-20#0285,¿Cuál es el efecto de la insuficiencia renal en las concentraciones plasmáticas de atorvastatin?,El deterioro de la función renal no tiene influencia sobre las concentraciones plasmáticas y los efectos hipolipemiantes del atorvastatin.,1,"['El deterioro de la función renal no tiene influencia sobre las concentraciones plasmáticas y sobre los efectos hipolipemeantes por AMPLIAR. Por lo tanto, no es necesario realizar ajustes en la dosis para estos pacientes.']","El deterioro de la función renal no tiene influencia sobre las concentraciones plasmáticas y sobre los efectos hipolipemeantes por AMPLIAR. Por lo tanto, no es necesario realizar ajustes en la dosis para estos pacientes."
Antimicon__E-1423-02-Instruccion-Antimicon#0300,¿Qué temperatura debe mantenerse el medicamento Antimicon?,Desde 15°C hasta 30°C,1,"['Conservar a temperatura ambiente desde 15°C hasta 30°C, al abrigo de la humedad.']","Conservar a temperatura ambiente desde 15°C hasta 30°C, al abrigo de la humedad."
Bemplas__D2948-E-2621-01-Instruccion-Bemblas-1#0315,¿Cómo ejerce su efecto diurético la clortalidona?,La clortalidona ejerce su efecto diurético a través de la inhibición de la reabsorción distal de sodio a nivel nefronal.,1,['la clortalidona ejerce su efecto diurético a través de la inhibición de la reabsorción distal de sodio a nivel nefronal.'],la clortalidona ejerce su efecto diurético a través de la inhibición de la reabsorción distal de sodio a nivel nefronal.
Blokium_B12_IM__Instrucci_n-Blokium-B12-IM-para-WEB#0330,¿Qué precaución se recomienda especialmente en pacientes con antecedentes de descompensación cardíaca?,Retención hidrosalina y edemas,1,"['Se ha observado diverso grado de retención hidrosalina incluso con edemas se ha observado en asociación con el uso de antiinflamatorios, por lo que se recomienda precaución, especialmente en pacientes con antecedentes de descompensación cardíaca, hipertensión u otra patología que predisponga a retención hidrosalina.']","Se ha observado diverso grado de retención hidrosalina incluso con edemas se ha observado en asociación con el uso de antiinflamatorios, por lo que se recomienda precaución, especialmente en pacientes con antecedentes de descompensación cardíaca, hipertensión u otra patología que predisponga a retención hidrosalina."
Blokium_B12_IM__Instrucci_n-Blokium-B12-IM-para-WEB#0345,¿Cómo conservar BLOKIUM B12 IM?,Conservar entre 15 y 30°C. Mantener alejado del alcance de los niños.,3,"['Conservar entre 15 y 30°C.', 'Mantener alejado del alcance de los niños', 'Envases con 3 y 5 ampollas.']",Conservar entre 15 y 30°C. || Mantener alejado del alcance de los niños || Envases con 3 y 5 ampollas.
Blokium_Cort__Instruccion-Blokium-Cort-para-Web#0360,¿Cuál es el medicamento que puede inhibir la acción farmacológica de los diuréticos?,BLOKIUM CORT,2,"['La administración simultánea de BLOKIUM CORT con otros antiinflamatorios no esteroideos sistémicos puede favorecer a la aparición de efectos adversos.', 'BLOKIUM CORT puede inhibir la acción farmacológica de los diuréticos.']",La administración simultánea de BLOKIUM CORT con otros antiinflamatorios no esteroideos sistémicos puede favorecer a la aparición de efectos adversos. || BLOKIUM CORT puede inhibir la acción farmacológica de los diuréticos.
Blokium_Cox_Gesic__D7689-E-7350-01-INST.-BLOKIUM-COX-GESIC-COMPLETA-UHLMANN-200x600-web#0375,¿Cuál medicamento puede potenciar la acción del paracetamol?,Propa nol ol,2,"['Propa nol ol: el propra nolol inhibe el sistema enzimá tic o respon sable de la glucuronidación y oxidación del paracetamol. Por lo tanto, puede potenciar la acción del paracetamol.', 'El propra nolol inhibe el sistema enzimá tic o respon sable de la glucuronidación y oxidación del paracetamol. Por lo tanto, puede potenciar la acción del paracetamol.']","Propa nol ol: el propra nolol inhibe el sistema enzimá tic o respon sable de la glucuronidación y oxidación del paracetamol. Por lo tanto, puede potenciar la acción del paracetamol. || El propra nolol inhibe el sistema enzimá tic o respon sable de la glucuronidación y oxidación del paracetamol. Por lo tanto, puede potenciar la acción del paracetamol."
Blokium_Cox__Instruccion-Blokium-Cox-editable#0390,¿Cuál es la indicación principal del medicamento BLOKIUM COX?,"El alivio sintomático de la artrosis u osteoartritis (OA), espondilitis anquilosante, artritis reumatoidea (AR) y el dolor y los signos de inflamación asociados con la artritis gotosa aguda.",2,"['BLOKIUM COX está indicado para el alivio sintomático de la artrosis u osteoartritis (OA), espondilitis anquilosante, artritis reumatoidea (AR), y para el dolor y los signos de inflamación asociados con la artritis gotosa aguda.', 'BLOKIUM COX también está indicado para el tratamiento a corto plazo del dolor moderado asociado a cirugía odontológica.']","BLOKIUM COX está indicado para el alivio sintomático de la artrosis u osteoartritis (OA), espondilitis anquilosante, artritis reumatoidea (AR), y para el dolor y los signos de inflamación asociados con la artritis gotosa aguda. || BLOKIUM COX también está indicado para el tratamiento a corto plazo del dolor moderado asociado a cirugía odontológica."
Blokium_Cox__Instruccion-Blokium-Cox-editable#0405,¿Qué efecto adverso puede ocurrir con BLOKIUM COX?,"Debilidad y fatiga, mareo, dolor de cabeza",7,"['Al igual que todos los medicamentos, BLOKIUM COX puede producir efectos adversos, aunque no todas las personas los sufran.', 'Si desarrolla alguno de los siguientes signos, deje de tomar BLOKIUM COX y hable con su médico inmediatamente.', 'Los siguientes efectos adversos pueden producirse durante el tratamiento con BLOKIUM COX. Frecuentes', 'Poco frecuentes', 'Raros', 'Muy raros', 'No conocidos']","Al igual que todos los medicamentos, BLOKIUM COX puede producir efectos adversos, aunque no todas las personas los sufran. || Si desarrolla alguno de los siguientes signos, deje de tomar BLOKIUM COX y hable con su médico inmediatamente. || Los siguientes efectos adversos pueden producirse durante el tratamiento con BLOKIUM COX. Frecuentes || Poco frecuentes || Raros || Muy raros || No conocidos"
Blokium_Flex__D2807-E-2481-03-Instrucci_n-Blokium-Flex-Sol-Inyectable-y-Comprimidos#0420,¿Qué efecto puede tener el diclofenac en los niveles plasmáticos del litio?,El diclofenac puede disminuir la depuración renal de litio y elevar los niveles plasmáticos del mismo.,1,"['El diclofenac puede disminuir la depuración renal de litio y elevar los niveles plasmáticos del mismo, aumentando así el riesgo de efectos adversos.']","El diclofenac puede disminuir la depuración renal de litio y elevar los niveles plasmáticos del mismo, aumentando así el riesgo de efectos adversos."
Blokium_Gel__Instruccion-Blokium-Gel-editable#0435,¿Qué tipo de inhibidor es el diclofenac?,inhibidor de la prostaglandina sintetasa,1,['Es inhibidor de la prostaglandina sintetasa.'],Es inhibidor de la prostaglandina sintetasa.
