chunk_id,question,answer,n_sentences,sentences,sentences_join
Dilcoran__MKG-Instruccion-Dilcoran#0975,¿Cuál es el efecto del valsartán sobre la función hepática en pacientes con hipertensión esencial?,No es necesario un monitoreo especial de los parámetros de laboratorio en los pacientes con hipertensión esencial que reciben tratamiento con valsartán.,2,"['No se requiere ajuste de dosis en los pacientes con insuficiencia hepática.', 'Se informaron elevaciones ocasionales de los valores de función hepática en pacientes tratados con valsartán.']",No se requiere ajuste de dosis en los pacientes con insuficiencia hepática. || Se informaron elevaciones ocasionales de los valores de función hepática en pacientes tratados con valsartán.
Elant__D3071-E-2744-01-Instruccion-Elant#0990,¿Qué clase ATC tiene la teneligliptina?,A10BH,1,['Clase ATC: A10BH.'],Clase ATC: A10BH.
Elifer__D1705-E-1406-02-Instruccion-Elifer#1005,¿Cuál es la cantidad de povidona K30 en cada comprimido recubierto de ELIFER 300?,0.600 mg,1,"['ELIFER 300: cada comprimido recubierto contiene: gabapentin 300 mg. Excipientes: copovidona 40,500 mg, fosfato tricálcico 53,475 mg, dióxido silicio coloidal 1,125 mg, crospovidona  45,000 mg,  talco  7,500  mg,  estearato  de  magnesio  5,400  mg,  bióxido  de  titanio  3,120  mg,  hidroxipropilmetilcelulosa E15 3,600 mg, polietilenglicol 6000 1,680 mg, povidona K30 0,600 mg.']","ELIFER 300: cada comprimido recubierto contiene: gabapentin 300 mg. Excipientes: copovidona 40,500 mg, fosfato tricálcico 53,475 mg, dióxido silicio coloidal 1,125 mg, crospovidona  45,000 mg,  talco  7,500  mg,  estearato  de  magnesio  5,400  mg,  bióxido  de  titanio  3,120  mg,  hidroxipropilmetilcelulosa E15 3,600 mg, polietilenglicol 6000 1,680 mg, povidona K30 0,600 mg."
Elifer__D1705-E-1406-02-Instruccion-Elifer#1020,¿Cuál es el efecto adverso más comúnmente asociado con el gabapentin en pacientes pediátricos?,Somnolencia,0,[],
Enabran__D1341-Instrucci_n-Enabran-1#1035,¿Cuál es el síntoma de hiperpirexia asociado al uso del haloperidol?,hiperpirexia,7,"['{', '""sentences"": [', '""Síndrome  neuroléptico  maligno:  este  complejo  sintomático  potencialmente  fatal  se  ha observado  en  asociación  a  drogas  antipsicóticas. Sus  manifestaciones  clínicas  son:', 'hiperpirexia, rigidez muscular, inestabilidad autonómica (pulso irregular, taquicardia, arritmias, diaforesis, alteración de la presión arterial) y alteración del estado mental (incluyendo catatonía);', 'puede ocurrir mioglobinuria e insuficiencia renal aguda. En caso de aparecer esta patología se debe discontinuar el haloperidol y efectuar tratamiento médico inmediato.""', ']', '}']","{ || ""sentences"": [ || ""Síndrome  neuroléptico  maligno:  este  complejo  sintomático  potencialmente  fatal  se  ha observado  en  asociación  a  drogas  antipsicóticas. Sus  manifestaciones  clínicas  son: || hiperpirexia, rigidez muscular, inestabilidad autonómica (pulso irregular, taquicardia, arritmias, diaforesis, alteración de la presión arterial) y alteración del estado mental (incluyendo catatonía); || puede ocurrir mioglobinuria e insuficiencia renal aguda. En caso de aparecer esta patología se debe discontinuar el haloperidol y efectuar tratamiento médico inmediato."" || ] || }"
Enabran_gotas__D1341-Instrucci_n-Enabran-1-gotas#1050,¿Cuál es el síndrome que puede aparecer en pacientes con haloperidol a largo plazo?,Disquinesia tardía,2,"['Disquinesia tardía:  este síndrome consistente en movimientos disquinéticos involuntarios potencialmente irreversibles puede desarrollarse en pacientes tratados con drogas antipsicóticas incluyendo el haloperidol.', 'Disquinesia tardía: es un síndrome consistente en movimientos involuntarios disquinéticos potencialmente irreversibles que pueden aparecer en pacientes en tratamiento con haloperidol a largo plazo o luego de sus suspensión.']",Disquinesia tardía:  este síndrome consistente en movimientos disquinéticos involuntarios potencialmente irreversibles puede desarrollarse en pacientes tratados con drogas antipsicóticas incluyendo el haloperidol. || Disquinesia tardía: es un síndrome consistente en movimientos involuntarios disquinéticos potencialmente irreversibles que pueden aparecer en pacientes en tratamiento con haloperidol a largo plazo o luego de sus suspensión.
Enolex__D2339-E-2020-01-Instruccion-Enolex_compressed#1065,¿Cuál es el rango de referencia COVANCE para Prolactina en mujeres de 12 a 14 años?,2.52 – 16.90 ng/mL,3,"['6 rango de referencia COVANCE para Prolactina según publicación de Wiedemann y Jonetz-Mentzel (1993): Mujeres 12 a 14 años: 2.52 – 16.90 ng/mL.', 'Hombres 12 a 14 años: 2.84 – 24.00 ng/mL', '14 a 19 años: 4.20 – 39.00 ng/mL']",6 rango de referencia COVANCE para Prolactina según publicación de Wiedemann y Jonetz-Mentzel (1993): Mujeres 12 a 14 años: 2.52 – 16.90 ng/mL. || Hombres 12 a 14 años: 2.84 – 24.00 ng/mL || 14 a 19 años: 4.20 – 39.00 ng/mL
Enolex__D2339-E-2020-01-Instruccion-Enolex_compressed#1080,¿Cuántas veces la dosis diaria máxima recomendada en seres humanos recibieron los monos rhesus de olanzapina?,8 veces la dosis diaria máxima recomendada en seres humanos sobre una base de mg/m2,1,['en ratas que recibieron dosis orales de hasta 15 veces la dosis diaria máxima recomendada en seres humanos (20 mg) y monos rhesus que recibieron dosis orales de hasta 8 veces la dosis diaria máxima recomendada en seres humanos sobre una base de mg/m2.'],en ratas que recibieron dosis orales de hasta 15 veces la dosis diaria máxima recomendada en seres humanos (20 mg) y monos rhesus que recibieron dosis orales de hasta 8 veces la dosis diaria máxima recomendada en seres humanos sobre una base de mg/m2.
Epistal__D1978-E-1691-02-Instrucci_n-Epistal-1#1095,¿Cuál es la incidencia de muertes súbitas inexplicables en pacientes que toman topiramato?,"0,0035 muertes por pacienteaño",2,"['Mientras duró el desarrollo de los comprimidos de topiramato, se registraron 10 muertes súbitas e inexplicables entre un cohorte de pacientes en tratamiento (2796 individuoaños de exposición).', 'Esto representa una incidencia de 0,0035 muertes por pacienteaño. A pesar de que este índice excede lo esperado en una población saludable equiparable en edad y sexo, se encuentra dentro del rango de los estimados para la incidencia de muertes súbitas inexplicables en pacientes epilépticos que no reciben topiramato (0,0005 para la población general de pacientes epilépticos, 0,003 para la población de un estudio clínico, similar a lo observado con topiramato y de 0,005 para pacientes con epilepsia refractaria).']","Mientras duró el desarrollo de los comprimidos de topiramato, se registraron 10 muertes súbitas e inexplicables entre un cohorte de pacientes en tratamiento (2796 individuoaños de exposición). || Esto representa una incidencia de 0,0035 muertes por pacienteaño. A pesar de que este índice excede lo esperado en una población saludable equiparable en edad y sexo, se encuentra dentro del rango de los estimados para la incidencia de muertes súbitas inexplicables en pacientes epilépticos que no reciben topiramato (0,0005 para la población general de pacientes epilépticos, 0,003 para la población de un estudio clínico, similar a lo observado con topiramato y de 0,005 para pacientes con epilepsia refractaria)."
Epistal__D1978-E-1691-02-Instrucci_n-Epistal-1#1110,¿Qué temperatura se recomienda para conservar el medicamento EPISTAL?,Entre 15 y 30 °C,1,"['Conservar entre 15 y 30 ̊C, proteger de la humedad.']","Conservar entre 15 y 30 ̊C, proteger de la humedad."
Ernex_Duo__D0299-E-0863-03-Instruccion-Ernex-Duo#1125,¿Qué tipo de venta tiene la Bencidamina?,Venta bajo receta,1,['VENTA BAJO RECETA'],VENTA BAJO RECETA
Ernex_Rosa__D0680-E-0305-03-Instrucci_n-Ernex-Rosa-Polvo#1140,¿Cuánto cloruro de sodio contiene cada sobre?,4.400 g,1,"['Cada sobre contiene: bencidamina clorhidrato 0,250 g. Excipientes: cetrimida  0,050 g; cloruro de sodio 4,400 g.']","Cada sobre contiene: bencidamina clorhidrato 0,250 g. Excipientes: cetrimida  0,050 g; cloruro de sodio 4,400 g."
Exogel__Instruccion-Exogel-1#1155,¿Cuál es la temperatura óptima para conservar EXOGEL?,Entre 15 y 30 °C,2,"['Conservar en lugar seco, entre 15 y 30 °C', '- Conservar en lugar seco, entre 15 y 30 °C']","Conservar en lugar seco, entre 15 y 30 °C || - Conservar en lugar seco, entre 15 y 30 °C"
Explaner_LP__D1792-E-1508-02-Instrucci_n-Explaner-LP-1#1170,¿Qué efecto adverso puede ocurrir en pacientes con trastorno de la función hepática que toman nimodipina?,La tensión arterial y el pulso deben controlarse cuidadosamente y deben darse dosis menores a las recomendadas.,2,"['En dichos pacientes la tensión arterial y el pulso debe controlarse cuidadosamente y deben darse dosis menores a las recomendadas.', 'En raras oportunidades se han reportado pseudo-obstrucción intestinal e íleo en pacientes tratados con nimodipina.']",En dichos pacientes la tensión arterial y el pulso debe controlarse cuidadosamente y deben darse dosis menores a las recomendadas. || En raras oportunidades se han reportado pseudo-obstrucción intestinal e íleo en pacientes tratados con nimodipina.
FILTEN-D-G00081104-05#1185,¿Quién es contraindicado para el tratamiento con Filtén D?,"Pacientes con bradicardia severa, shock cardiogénico, bloqueo AV de segundo y tercer grado, enfermedad del nódulo sinusal, insuficiencia cardíaca descompensada (clase IV NYHA), hipotensión severa, angina variante o de Prinzmetal, hipertensión pulmonar, cor pulmonale, antecedentes de enfermedad obstructiva de las vías aéreas, asma bronquial, insuficiencia hepática o renal severa, anuria, hipersensibilidad conocida al carvedilol, hidroclorotiazida, sulfamidas y derivados, hipopotasemia e hiponatremia refractarias, hipercalcemia, hipofunción de las glándulas suprarrenales, embarazo, lactancia, niños y adolescentes menores de 18 años.",4,"['FILTEN® D se encuentra contraindicado en pacientes con bradicardia severa, shock cardiogénico, bloqueo AV de segundo y tercer grado, enfermedad del nódulo sinusal (incluyendo bloqueo sino-auricular), insuficiencia cardíaca descompensada (clase IV NYHA) que requiera tratamiento inotrópico intravenoso, hipotensión severa (presión arterial sistólica < 85 mmHg).', 'Angina variante o de Prinzmetal. Hipertensión pulmonar, cor pulmonale. Antecedentes de enfermedad obstructiva de las vías aéreas, asma bronquial, insuficiencia hepática o renal severa, anuria.', 'Hipersensibilidad conocida al carvedilol, a la hidroclorotiazida, a las sulfamidas y derivados, o a alguno de los excipientes del producto. Hipopotasemia e hiponatremia refractarias. Hipercalcemia. Hipofunción de las glándulas suprarrenales (enfermedad de Addison).', 'Administración concomitante con inhibidores de la monoamino-oxidasa o verapamilo y diltiazem por vía intravenosa. Diabetes mellitus descompensada. Embarazo. Lactancia. Niños y adolescentes menores de 18 años.']","FILTEN® D se encuentra contraindicado en pacientes con bradicardia severa, shock cardiogénico, bloqueo AV de segundo y tercer grado, enfermedad del nódulo sinusal (incluyendo bloqueo sino-auricular), insuficiencia cardíaca descompensada (clase IV NYHA) que requiera tratamiento inotrópico intravenoso, hipotensión severa (presión arterial sistólica < 85 mmHg). || Angina variante o de Prinzmetal. Hipertensión pulmonar, cor pulmonale. Antecedentes de enfermedad obstructiva de las vías aéreas, asma bronquial, insuficiencia hepática o renal severa, anuria. || Hipersensibilidad conocida al carvedilol, a la hidroclorotiazida, a las sulfamidas y derivados, o a alguno de los excipientes del producto. Hipopotasemia e hiponatremia refractarias. Hipercalcemia. Hipofunción de las glándulas suprarrenales (enfermedad de Addison). || Administración concomitante con inhibidores de la monoamino-oxidasa o verapamilo y diltiazem por vía intravenosa. Diabetes mellitus descompensada. Embarazo. Lactancia. Niños y adolescentes menores de 18 años."
FILTEN-D-G00081104-05#1200,¿Cuál es el efecto común de la medicación en la visión?,Disminución del lagrimeo y alteraciones en la visión,1,"['Frecuentes: Disminución del lagrimeo (ojo seco), irritación de los ojos, alteraciones en la visión.']","Frecuentes: Disminución del lagrimeo (ojo seco), irritación de los ojos, alteraciones en la visión."
Factor_AE_Venta_Libre___D0751-E-1133-02-Instrucci_n-Factor-AE-1#1215,¿A qué temperatura se debe conservar el medicamento CASASCO?,Entre 15 y 30°C,1,"['- Conservar en lugar fresco y seco, preferentemente entre 15 y 30°C.']","- Conservar en lugar fresco y seco, preferentemente entre 15 y 30°C."
Factor_AG__D0328-E-0291-04-Instrucci_n-Factor-AG-200-1-1#1245,¿Cuál es la cantidad de fosfato tricálcico en cada comprimido?,"481,241 mg",1,"['Cada comprimido contiene: simeticona 200,000 mg. Excipientes: gelatina 13,500 mg, almidón pregelatinizado 13,500 mg, fosfato tricálcico 481,241 mg,']","Cada comprimido contiene: simeticona 200,000 mg. Excipientes: gelatina 13,500 mg, almidón pregelatinizado 13,500 mg, fosfato tricálcico 481,241 mg,"
Factor_D_rmico__Instruccion-Factor-Dermico-Venta#1260,¿Qué tipo de hongos patógenos es efectivo el miconazol contra?,"Dermatofitos, levaduras y otros hongos patógenos para el hombre.",2,"['el miconazol es un antifúngico azólico activo contra dermatofitos, levaduras y otros  hongos  patógenos  para  el  hombre.', 'El  miconazol  presenta  actividad  específicamente  sobre  Trichophyton  rubrum,']","el miconazol es un antifúngico azólico activo contra dermatofitos, levaduras y otros  hongos  patógenos  para  el  hombre. || El  miconazol  presenta  actividad  específicamente  sobre  Trichophyton  rubrum,"
Fentaxina__D1514-E-1254-02-Instrucci_n-Fentaxina-1#1275,¿Cuántos días dura la dosis de 750 mg del medicamento?,7 días,10,"['{', '""sentences"": [', '""Duración (**)', '7 días', '7-14 días', '7-14 días"",', '""cada 24 h', '750""', ']', '}']","{ || ""sentences"": [ || ""Duración (**) || 7 días || 7-14 días || 7-14 días"", || ""cada 24 h || 750"" || ] || }"
Fentaxina__D1514-E-1254-02-Instrucci_n-Fentaxina-1#1290,¿Cuál es el tratamiento recomendado para una sobredosificación de levofloxacina?,"Controlar cuidadosamente al paciente, incluir monitoreo electrocardiográfico y tratamiento sintomático. Considerar lavado gástrico en caso de sobredosificación aguda.",4,"['en casos de sobredosificación, controlar cuidadosamente al paciente (incluir monitoreo electrocardiográfico) e implementar tratamiento sintomático.', 'Si hubiera sobredosis aguda, considerar la realización de lavado gástrico. Pueden usarse antiácidos para proteger la mucosa gástrica.', 'La hemodiálisis, incluyendo diálisis peritoneal y diálisis peritoneal ambulatoria continua no son efectivas para la remoción corporal de levofloxacina.', 'No hay antídoto específico. Ante la eventualidad de una sobredosificación, concurrir al Hospital más cercano o comunicarse con los Centros de Toxicología:']","en casos de sobredosificación, controlar cuidadosamente al paciente (incluir monitoreo electrocardiográfico) e implementar tratamiento sintomático. || Si hubiera sobredosis aguda, considerar la realización de lavado gástrico. Pueden usarse antiácidos para proteger la mucosa gástrica. || La hemodiálisis, incluyendo diálisis peritoneal y diálisis peritoneal ambulatoria continua no son efectivas para la remoción corporal de levofloxacina. || No hay antídoto específico. Ante la eventualidad de una sobredosificación, concurrir al Hospital más cercano o comunicarse con los Centros de Toxicología:"
G00072104-08-ALPLAX_XR_web#1320,¿Cuáles son las presentaciones de ALPLAX XR?,ALPLAX XR 0.5; 1 y 2: Se presenta en envases conteniendo 20 comprimidos de liberación sostenida.,2,"['ALPLAX XR® 0,5; 1 y 2: Se presenta en envases conteniendo 20 comprimidos de liberación sostenida.', 'MANTENER TODOS LOS MEDICAMENTOS FUERA DEL ALCANCE DE LOS NIÑOS. ALPLAX XR® lejos del alcance de los niños.']","ALPLAX XR® 0,5; 1 y 2: Se presenta en envases conteniendo 20 comprimidos de liberación sostenida. || MANTENER TODOS LOS MEDICAMENTOS FUERA DEL ALCANCE DE LOS NIÑOS. ALPLAX XR® lejos del alcance de los niños."
G00072203-01-april-web#1335,¿Cuál es el riesgo relativo de trombosis venosa en mujeres que usan anticonceptivos orales combinados con factores predisponentes?,El riesgo relativo de trombosis venosa en mujeres que usan anticonceptivos orales combinados con factores predisponentes es el doble del que se observa en mujeres que no presentan condiciones predisponentes.,4,"['El riesgo relativo de trombosis venosa en usuarias de anticonceptivos orales es de 3 para el primer episodio de trombosis venosa superficial, de 4 a 11 para trombosis venosa profunda o embolia pulmonar, y de 1,5 a 6 en mujeres con factores predisponentes para enfermedad tromboembólica venosa.', 'El riesgo relativo es algo menor, de aproximadamente 3 para casos nuevos y de 4,5 para casos nuevos que requieran hospitalización.', 'El exceso de riesgo es mayor durante el primer año que una mujer utiliza un anticonceptivo oral combinado.', 'Entre las condiciones que predisponen a la aparición de trombosis venosa y tromboembolismo se encuentran la obesidad, cirugía o traumatismo, parto reciente o aborto en el segundo trimestre, inmovilización prolongada, edad avanzada.']","El riesgo relativo de trombosis venosa en usuarias de anticonceptivos orales es de 3 para el primer episodio de trombosis venosa superficial, de 4 a 11 para trombosis venosa profunda o embolia pulmonar, y de 1,5 a 6 en mujeres con factores predisponentes para enfermedad tromboembólica venosa. || El riesgo relativo es algo menor, de aproximadamente 3 para casos nuevos y de 4,5 para casos nuevos que requieran hospitalización. || El exceso de riesgo es mayor durante el primer año que una mujer utiliza un anticonceptivo oral combinado. || Entre las condiciones que predisponen a la aparición de trombosis venosa y tromboembolismo se encuentran la obesidad, cirugía o traumatismo, parto reciente o aborto en el segundo trimestre, inmovilización prolongada, edad avanzada."
G00072203-01-april-web#1350,¿Cuál es la dosis de etinilestradiol en cada comprimido recubierto de APRIL?,0.020 mg,1,"['Cada comprimido recubierto de APRIL® contiene: Levonorgestrel ...........................................................................0,100 mg Etinilestradiol ............................................................................ 0,020 mg']","Cada comprimido recubierto de APRIL® contiene: Levonorgestrel ...........................................................................0,100 mg Etinilestradiol ............................................................................ 0,020 mg"
G00072601-09-AMBISOME-Prospecto-web#1365,¿Cuál es la cantidad de anfotericina B en cada frasco ampolla de AMBISOME?,50 mg,1,['Cada frasco ampolla de polvo liofilizado de AMBISOME® contiene: Anfotericina B (en liposomas) ............................................ 50 mg'],Cada frasco ampolla de polvo liofilizado de AMBISOME® contiene: Anfotericina B (en liposomas) ............................................ 50 mg
G00072601-09-AMBISOME-Prospecto-web#1380,¿Cuál es el riesgo de hipopotasemia en pacientes que reciben AMBISOME?,Es posible que se requiera un suplemento adecuado de potasio durante el ciclo de administración de AMBISOME® debido al riesgo de hipopotasemia.,3,"['Debido al riesgo de hipopotasemia, es posible que se requiera un suplemento adecuado de potasio durante el ciclo de administración de AMBISOME.', 'La hipopotasemia inducida por AMBISOME puede potenciar la toxicidad de los digitálicos.', 'La hipopotasemia inducida por AMBISOME puede aumentar el efecto curariforme de los miorrelajantes (por ejemplo, tubocurarina).']","Debido al riesgo de hipopotasemia, es posible que se requiera un suplemento adecuado de potasio durante el ciclo de administración de AMBISOME. || La hipopotasemia inducida por AMBISOME puede potenciar la toxicidad de los digitálicos. || La hipopotasemia inducida por AMBISOME puede aumentar el efecto curariforme de los miorrelajantes (por ejemplo, tubocurarina)."
