chunk_id,question,answer,n_sentences,sentences,sentences_join
Blokium_Gesic_Forte__Instruccion-Blokium-Gesic-Forte-web#0450,¿Qué es el tratamiento sintomático de la dismenorrea primaria?,"Antiinflamatorio, analgésico y antipirético no esteroide.",6,"['{', '""sentences"": [', '""Tratamiento sintomático a corto plazo (máximo 2 semanas) de procesos dolorosos agudos de intensidad leve a moderada:"",', '""Estados dolorosos y/o dismenorrea, anexitis, etc.). • Inflamación y dolores postoperatorios (por ejemplo: cirugía dental u ortopédica). • Odontalgias. • Estados inflamatorios y dolorosos postraumáticos (por ejemplo: entorsis). • Crisis de migraña. • Adyuvante en dolorosas severas (por ejemplo: faringitis, otitis). • Síndromes vertebrales dolorosos. • Reumatismo extraarticular.""', ']', '}']","{ || ""sentences"": [ || ""Tratamiento sintomático a corto plazo (máximo 2 semanas) de procesos dolorosos agudos de intensidad leve a moderada:"", || ""Estados dolorosos y/o dismenorrea, anexitis, etc.). • Inflamación y dolores postoperatorios (por ejemplo: cirugía dental u ortopédica). • Odontalgias. • Estados inflamatorios y dolorosos postraumáticos (por ejemplo: entorsis). • Crisis de migraña. • Adyuvante en dolorosas severas (por ejemplo: faringitis, otitis). • Síndromes vertebrales dolorosos. • Reumatismo extraarticular."" || ] || }"
Blokium_P__MKG-Instruccion-Blokium-P#0495,¿Cuál es el tipo de medicamento que es el diclofenac potásico?,Antiinflamatorio no esteroideo (AINE),2,"['el diclofenac potásico, principio activo de  BLOKIUM P es un antiinflamatorio no esteroideo (AINE) derivado del ácido bencenoacético.', 'Como con otros AINES su modo de acción no está completamente aclarado; la capacidad para inhibir la síntesis de prostaglandinas participa en su actividad farmacológica.']","el diclofenac potásico, principio activo de  BLOKIUM P es un antiinflamatorio no esteroideo (AINE) derivado del ácido bencenoacético. || Como con otros AINES su modo de acción no está completamente aclarado; la capacidad para inhibir la síntesis de prostaglandinas participa en su actividad farmacológica."
Blokium_Protect__D2936-E-2609-01-Instruccion-Blokium-Protect#0510,¿Qué es el mecanismo de acción del diclofenac en el proceso inflamatorio?,"El diclofenac inhibe la síntesis y liberación de prostaglandinas durante el proceso inflamatorio, inhibiendo ambas isoenzimas ciclo-oxigenasas conocidas (COX1 y COX2).",3,"['El mecanismo de acción resulta en parte de la inhibición de la síntesis y liberación de prostaglandinas durante el proceso inflamatorio.', 'Diclofenac inhibe ambas isoenzimas ciclo-oxigenasas conocidas actualmente (COX1 y COX2).', 'Se ha informado que el diclofenac en altas concentraciones inhibe la formación de metabolitos del ácido araquidónico, incluyendo leucotrienos y de ácido 5-hidroxieicosatetraenoico (5-HETE).']","El mecanismo de acción resulta en parte de la inhibición de la síntesis y liberación de prostaglandinas durante el proceso inflamatorio. || Diclofenac inhibe ambas isoenzimas ciclo-oxigenasas conocidas actualmente (COX1 y COX2). || Se ha informado que el diclofenac en altas concentraciones inhibe la formación de metabolitos del ácido araquidónico, incluyendo leucotrienos y de ácido 5-hidroxieicosatetraenoico (5-HETE)."
Brimepil_Ez__D8223-E-7880-01-INST.-BRIMEPIL-EZ-180-10-COMPL.-BOY-600x200-web#0540,¿Cuántas veces mayor fue la exposición al ácido bempedoico en pacientes con insuficiencia renal leve?,1.4 veces,2,"['El AUC medio del ácido bempedoico en sujetos con insuficiencia renal leve (n=8) fue 1,5 veces mayor en comparación con aquellos con función renal normal (n=6).', 'En un análisis farmacocinético poblacional con datos agrupados de todos los ensayos clínicos (n=2261) para evaluar más a fondo los efectos de la función renal sobre el AUC en estado estacionario del ácido bempedoico, se encontró que en comparación con los pacientes con función renal normal, las exposiciones medias al ácido bempedoico fueron mayores en pacientes con insuficiencia renal leve o moderada, 1,4 veces (IC del 90%: 1,3, 1,4) y 1,9 veces (IC del 90%: 1,7, 2,0), respectivamente.']","El AUC medio del ácido bempedoico en sujetos con insuficiencia renal leve (n=8) fue 1,5 veces mayor en comparación con aquellos con función renal normal (n=6). || En un análisis farmacocinético poblacional con datos agrupados de todos los ensayos clínicos (n=2261) para evaluar más a fondo los efectos de la función renal sobre el AUC en estado estacionario del ácido bempedoico, se encontró que en comparación con los pacientes con función renal normal, las exposiciones medias al ácido bempedoico fueron mayores en pacientes con insuficiencia renal leve o moderada, 1,4 veces (IC del 90%: 1,3, 1,4) y 1,9 veces (IC del 90%: 1,7, 2,0), respectivamente."
Brimepil_Ez__D8223-E-7880-01-INST.-BRIMEPIL-EZ-180-10-COMPL.-BOY-600x200-web#0555,¿Cuál es el medicamento que debe evitarse en pacientes con insuficiencia renal?,"No se menciona un medicamento específico que deba evitarse en pacientes con insuficiencia renal. Sin embargo, el uso de fluoroquinolonas podría ser problemático.",2,"['El ácido bempedoico se asocia con un mayor riesgo de rotura o lesión tendinosa.', 'La rotura tendinosa podría ocurrir con mayor frecuencia en pacientes mayores de 60 años, en aquellos que toman corticosteroides o fluoroquinolonas, en pacientes con insuficiencia renal y en pacientes con trastornos tendinosos previos.']","El ácido bempedoico se asocia con un mayor riesgo de rotura o lesión tendinosa. || La rotura tendinosa podría ocurrir con mayor frecuencia en pacientes mayores de 60 años, en aquellos que toman corticosteroides o fluoroquinolonas, en pacientes con insuficiencia renal y en pacientes con trastornos tendinosos previos."
Broncho-Vaxom_C_psulas__D0265-E-0829-05-Instrucci_n-Broncho-Vaxom-C_psulas-1#0570,¿Qué precaución se recomienda durante el embarazo con BRONCHO-VAXOM?,Es recomendable evitar el uso de BRONCHO-VAXOM durante el embarazo.,2,"['Como medida preventiva, es recomendable evitar el uso de BRONCHO-VAXOM® durante el embarazo.', 'El producto debe ser administrado con precaución durante el embarazo y la lactancia.']","Como medida preventiva, es recomendable evitar el uso de BRONCHO-VAXOM® durante el embarazo. || El producto debe ser administrado con precaución durante el embarazo y la lactancia."
Callexe_Inyectable__Instruccion-Callexe-Inyectable-editable#0585,¿Cuál es el efecto de la edad en la farmacocinética del levetiracetam?,"La farmacocinética de levetiracetam se evaluó en 16 sujetos ancianos con clearance de creatinina que se extendía de 30 a 74 mL/min. El clearance corporal total disminuyó 38% y la vida media fue 2,5 horas más prolongada en los ancianos.",2,"['La vida media plasmática de levetiracetam durante los estudios es aproximadamente de entre 6 a 8 horas. Aumenta en los pacientes geriátricos (principalmente debido a un deterioro del clearance renal) y en sujetos con deterioro renal.', 'Después de la administración oral dos veces al día de la dosis, durante 10 días, el clearance corporal total disminuyó 38% y la vida media fue 2,5 horas más prolongada en los ancianos, comparada con la de los adultos sanos. Esto probablemente se deba a la disminución en la función renal en estos sujetos.']","La vida media plasmática de levetiracetam durante los estudios es aproximadamente de entre 6 a 8 horas. Aumenta en los pacientes geriátricos (principalmente debido a un deterioro del clearance renal) y en sujetos con deterioro renal. || Después de la administración oral dos veces al día de la dosis, durante 10 días, el clearance corporal total disminuyó 38% y la vida media fue 2,5 horas más prolongada en los ancianos, comparada con la de los adultos sanos. Esto probablemente se deba a la disminución en la función renal en estos sujetos."
Callexe_Inyectable__Instruccion-Callexe-Inyectable-editable#0600,¿Cuál fue el evento psiquiátrico informado con mayor frecuencia en pacientes tratados con levetiracetam?,La irritabilidad,2,"['el evento psiquiátrico informado con mayor frecuencia fue la irritabilidad, que ocurrió en el 6,3% de los pacientes tratados con levetiracetam en comparación con el 2,4% de los paciente tratados con placebo.', 'Además,  ocurrieron  trastornos  de  conducta  no  psicóticos  (informados  como  conducta  anormal,  agresión,  trastornos  de conducta e irritabilidad) en el 11,4% de los pacientes tratados con levetiracetam en comparación con el 3,6% de los pacientes tratados con placebo.']","el evento psiquiátrico informado con mayor frecuencia fue la irritabilidad, que ocurrió en el 6,3% de los pacientes tratados con levetiracetam en comparación con el 2,4% de los paciente tratados con placebo. || Además,  ocurrieron  trastornos  de  conducta  no  psicóticos  (informados  como  conducta  anormal,  agresión,  trastornos  de conducta e irritabilidad) en el 11,4% de los pacientes tratados con levetiracetam en comparación con el 3,6% de los pacientes tratados con placebo."
Callexe_XR__Callexe-XR_compressed#0615,¿Cuál es el peso de hidroxipropilmetilcelulosa K 15 en los comprimidos recubiertos de liberación extendida x 750 mg?,"198,000 mg",2,"['hidroxipropilmetilcelulosa K 15  132,000 mg;', 'hidroxipropilmetilcelulosa K 15  198,000 mg;']","hidroxipropilmetilcelulosa K 15  132,000 mg; || hidroxipropilmetilcelulosa K 15  198,000 mg;"
Callexe_XR__Callexe-XR_compressed#0630,¿Cuál es el efecto de levetiracetam en la farmacocinética del valproato?,Levetiracetam comprimidos de liberación inmediata (1.500 mg dos veces por día) no alteró la farmacocinética de valproato en voluntarios sanos.,2,"['Levetiracetam comprimidos de liberación inmediata (1.500 mg dos veces por día) no alteró la farmacocinética de valproato en voluntarios sanos.', 'Valproato 500 mg dos veces por día no modificó el porcentaje o el grado de absorción de levetiracetam o su clearance plasmático o excreción urinaria.']",Levetiracetam comprimidos de liberación inmediata (1.500 mg dos veces por día) no alteró la farmacocinética de valproato en voluntarios sanos. || Valproato 500 mg dos veces por día no modificó el porcentaje o el grado de absorción de levetiracetam o su clearance plasmático o excreción urinaria.
Cardiplen_2_5_5_y_10_mg__D7143-E-6804-01-INST.-CARDIPLEN-COMPLETO-UHLMANN-250x150-mm-web#0645,¿Cuál es la dosis máxima recomendada de CARDIPLEN para el tratamiento de insuficiencia cardíaca crónica estable?,10 mg una vez al día,2,"['La dosis máxima recomendada es 10 mg una vez al día y debería alcanzarse en un plazo no menor a las 12 semanas.', 'El tratamiento de la insuficiencia cardíaca crónica estable con bisoprolol es generalmente un tratamiento de larga duración.']",La dosis máxima recomendada es 10 mg una vez al día y debería alcanzarse en un plazo no menor a las 12 semanas. || El tratamiento de la insuficiencia cardíaca crónica estable con bisoprolol es generalmente un tratamiento de larga duración.
Carrier_20__D1958-E-1672-02-Instruccion-Carrier-20-1#0660,¿Cuál es el tratamiento sintomático para la demencia tipo Alzheimer de intensidad moderada a severa?,tratamiento sintomático de la demencia tipo Alzheimer de intensidad moderada a severa,2,"['tratamiento sintomático de la demencia tipo Alzheimer de intensidad moderada a severa.', 'Código ATC: N06DX01. Antidemencial.']",tratamiento sintomático de la demencia tipo Alzheimer de intensidad moderada a severa. || Código ATC: N06DX01. Antidemencial.
Carrier_Plus__D2129-E-1850-02-Instruccion-Carrier-plus#0675,¿Cuál es el efecto adverso más común de la memantina en pacientes con asma?,Trastornos respiratorios,3,"['- Trastornos respiratorios: debido a su actividad colinérgica, los inhibidores de la colinesterasa deben ser indicados con precaución a pacientes con antecedentes de asma o de enfermedad pulmonar obstructiva.', '- Piel y fanega - Frecuentes: cataratas, conjuntivitis. Infrecuente: degeneración macular, disminución de la agudeza visual, disminución de la audición, acúfenos, blefaritis, visión borrosa, opacidad corneal, glaucoma, hemorragia conjuntival, dolor ocular, hemorragia retinal, xeroftalmia, diplopía, lagrimeo anormal, miopatía, desprendimiento de retina.', '- Sistema respiratorio - Frecuente: neumonía. Infrecuentes: apnea, asma, hemoptisis.']","- Trastornos respiratorios: debido a su actividad colinérgica, los inhibidores de la colinesterasa deben ser indicados con precaución a pacientes con antecedentes de asma o de enfermedad pulmonar obstructiva. || - Piel y fanega - Frecuentes: cataratas, conjuntivitis. Infrecuente: degeneración macular, disminución de la agudeza visual, disminución de la audición, acúfenos, blefaritis, visión borrosa, opacidad corneal, glaucoma, hemorragia conjuntival, dolor ocular, hemorragia retinal, xeroftalmia, diplopía, lagrimeo anormal, miopatía, desprendimiento de retina. || - Sistema respiratorio - Frecuente: neumonía. Infrecuentes: apnea, asma, hemoptisis."
Carrier_XR__D3160-E-2834-01-Instruccion-CarrierXR#0690,¿Cuál es el número de certificado del medicamento CARRIER XR?,51.342,1,['Dirección Técnica: Dr. Luis M. Radici – Farmacéutico. ESPECIALIDAD MEDICINAL AUTORIZADA POR EL MINISTERIO DE SALUD. Certificado N° 51.342'],Dirección Técnica: Dr. Luis M. Radici – Farmacéutico. ESPECIALIDAD MEDICINAL AUTORIZADA POR EL MINISTERIO DE SALUD. Certificado N° 51.342
Cominar__D2745-E-2423-01-Instruccion-Cominar-1#0705,¿Cuánto lactosa contiene cada cápsula de Diacereína?,226.0 mg,1,"['Cada  cápsula  contiene: DIACEREÍNA  50,0  mg. Excipientes:  lactosa  226,0  mg,']","Cada  cápsula  contiene: DIACEREÍNA  50,0  mg. Excipientes:  lactosa  226,0  mg,"
Conductasa_1200__Instruccion-Conductasa-1200-180x300-WEB#0720,¿Cuál es el efecto de la mesalazina en la activación de NFkB?,La mesalazina puede inhibir la activación de NFkB.,1,"['Datos recientes también sugieren que la mesalazina puede inhibir la activación de NFkB, un factor de transcripción nuclear que regula la transcripción de muchos genes para proteínas pro-inflamatorias, lo que llevó a la conclusión que esta acción puede reforzar los efectos de la droga.']","Datos recientes también sugieren que la mesalazina puede inhibir la activación de NFkB, un factor de transcripción nuclear que regula la transcripción de muchos genes para proteínas pro-inflamatorias, lo que llevó a la conclusión que esta acción puede reforzar los efectos de la droga."
Corticas_Crema__D2347-E-1917-01-Instrucci_n-Corticas-Crema-1#0750,¿Qué efecto tiene la inflamación en la absorción percutánea de los corticoides tópicos?,"{   ""answer"": La inflamación aumenta la absorción percutánea de los corticoides tópicos. }",2,"['La inflamación y/u otros procesos patológicos de la piel aumentan la absorción percutánea.', 'Los corticoides tópicos pueden ser absorbidos a través de la piel normal intacta.']",La inflamación y/u otros procesos patológicos de la piel aumentan la absorción percutánea. || Los corticoides tópicos pueden ser absorbidos a través de la piel normal intacta.
Corticas_L_UD__D2156-E-1877-01-Instruccion-CORTICAS-L-UD-1#0765,¿Qué pacientes no deben usar CORTICAS L UD?,Pacientes con hipersensibilidad o idiosincrasia demostrada a cualquiera de sus componentes y pacientes con infecciones micóticas sistémicas.,4,"['CORTICAS L UD está contraindicado en pacientes con hipersensibilidad o idiosincrasia demostrada a cualquiera de sus componentes.', 'La betametasona está contraindicada en pacientes con infecciones micóticas sistémicas.', 'Durante la corticoterapia los pacientes no deben vacunarse contra la viruela. Tampoco deben llevarse a cabo otros procedimientos de inmunización mientras se estén recibiendo corticosteroides, especialmente en dosis elevadas, debido al peligro potencial de complicaciones neurológicas y a la falta de respuesta en la producción de anticuerpos.', 'Advertencias: los corticosteroides pueden enmascarar algunos signos de infección, y durante su uso pueden desarrollarse nuevas infecciones.']","CORTICAS L UD está contraindicado en pacientes con hipersensibilidad o idiosincrasia demostrada a cualquiera de sus componentes. || La betametasona está contraindicada en pacientes con infecciones micóticas sistémicas. || Durante la corticoterapia los pacientes no deben vacunarse contra la viruela. Tampoco deben llevarse a cabo otros procedimientos de inmunización mientras se estén recibiendo corticosteroides, especialmente en dosis elevadas, debido al peligro potencial de complicaciones neurológicas y a la falta de respuesta en la producción de anticuerpos. || Advertencias: los corticosteroides pueden enmascarar algunos signos de infección, y durante su uso pueden desarrollarse nuevas infecciones."
Corticas_L__D1689-E-1557-01-Instrucci_n-Corticas-L-1#0780,¿Cuál es el efecto de la rifampicina en los corticosteroides durante la quimioprofilaxis?,"La rifampicina incrementa la depuración metabólica hepática de los corticosteroides, por lo cual puede ser necesario un ajuste de la dosis de los mismos.",1,"['Durante la corticoterapia prolongada, los enfermos deben recibir quimioprofilaxis. Cuando se utilice rifampicina en un programa quimioprofiláctico, debe tenerse en cuenta que la misma incrementa la depuración metabólica hepática de los corticosteroides, por lo cual puede ser necesario un ajuste de la dosis de los mismos.']","Durante la corticoterapia prolongada, los enfermos deben recibir quimioprofilaxis. Cuando se utilice rifampicina en un programa quimioprofiláctico, debe tenerse en cuenta que la misma incrementa la depuración metabólica hepática de los corticosteroides, por lo cual puede ser necesario un ajuste de la dosis de los mismos."
Crada__Instruccion-Crada-Web-1#0795,¿Cómo debe ser administrado CRADA según las instrucciones?,Siga exactamente las instrucciones de administración de CRADA indicadas por su médico.,2,"['Siga exactamente las instrucciones de administración de CRADA indicadas por su médico.', 'Consulte a su médico o farmacéutico si tiene dudas.']",Siga exactamente las instrucciones de administración de CRADA indicadas por su médico. || Consulte a su médico o farmacéutico si tiene dudas.
Crono_Corticas__D1735-E-1446-02-Instruccion-Crono-Corticas#0810,¿Qué temperatura se recomienda para conservar el medicamento?,Entre 15°C y 30°C,1,"['- Proteger de la luz, entre 15°C y 30°C.']","- Proteger de la luz, entre 15°C y 30°C."
Danlox_40_Venta_Libre___D0995-E-0321-04-Instrucci_n-Danlox-2#0825,¿Cuál es la dosis habitual de DANLOX para tratar una ulcera duodenal?,20 mg por día,0,[],
Dercolina_A__Instruccion-Dercolina-A-Adultos#0840,¿Cuál es la edad mínima para usar DERCOLINA A Adultos en niños?,12 años de edad,2,"['No debe usarse en niños menores de 12 años.', 'Uso en niños No debe usarse en niños menores de 12 años de edad.']",No debe usarse en niños menores de 12 años. || Uso en niños No debe usarse en niños menores de 12 años de edad.
Dercolina__D2607-E-2285-01-Instruccion-Dercolina-Jalea#0855,¿Qué tipo de lesiones se mencionan en el contexto?,"ulceraciones, heridas, irritaciones de la mucosa bucal",1,"['ulceraciones, heridas, irritaciones de la mucosa bucal (labios, paladar, encías, lengua).']","ulceraciones, heridas, irritaciones de la mucosa bucal (labios, paladar, encías, lengua)."
Detixol__D3222-E-2897-01-Instruccion-Detixol#0870,¿Cuántas horas prolonga la actividad terapéutica del Succinato de doxilamina?,4-6 horas,1,"['Tras su administración por vía oral alcanza concentraciones máximas a las 2-3 horas de su ingesta, prolongándose su actividad terapéutica durante un período de 4-6 horas.']","Tras su administración por vía oral alcanza concentraciones máximas a las 2-3 horas de su ingesta, prolongándose su actividad terapéutica durante un período de 4-6 horas."
Dilcoran_D__D2639-E-2317-01-Instrucci_n-Dilcoran-D-1#0885,¿Cuál es el riesgo de efectos adversos causados por la amantadina cuando se administra concomitantemente con diuréticos tiazídicos?,La administración concomitante de diuréticos tiazídicos puede aumentar el riesgo de efectos adversos causados por amantadina.,1,"['La administración concomitante de diuréticos tiazídicos, incluyendo la hidroclorotiazida, puede aumentar el riesgo de efectos adversos causados por amantadina,']","La administración concomitante de diuréticos tiazídicos, incluyendo la hidroclorotiazida, puede aumentar el riesgo de efectos adversos causados por amantadina,"
Dilcoran_D__D2639-E-2317-01-Instrucci_n-Dilcoran-D-1#0900,¿Qué síntomas deben notar los pacientes que toman DILCORAN D?,"Hinchazón en la cara, lengua o faringe, dificultad para tragar, urticaria y dificultad para respirar.",4,"['Debe visitar a su médico inmediatamente si nota síntomas de angioedema, tales como', 'Hinchazón en la cara, lengua o faringe', 'Dificultad para tragar', 'Urticaria y dificultad para respirar']","Debe visitar a su médico inmediatamente si nota síntomas de angioedema, tales como || Hinchazón en la cara, lengua o faringe || Dificultad para tragar || Urticaria y dificultad para respirar"
Dilcoran_Plus_D__D5665-E-5330-01-Instruccion-Dilcoran-Plus-D-Uhlmann-600x200-1#0915,¿Cuál es el efecto de la insuficiencia renal en la vida media de eliminación de hidroclorotiazida?,La vida media de eliminación de hidroclorotiazida es casi el doble en pacientes con insuficiencia renal leve a moderada.,2,"['En pacientes con insuficiencia renal leve a moderada, la vida media de eliminación es casi el doble.', 'El aclaramiento renal de hidroclorotiazida también se reduce en gran medida en comparación con el aclaramiento renal de aproximadamente 300 mL/min que presentan los pacientes con función renal conservada.']","En pacientes con insuficiencia renal leve a moderada, la vida media de eliminación es casi el doble. || El aclaramiento renal de hidroclorotiazida también se reduce en gran medida en comparación con el aclaramiento renal de aproximadamente 300 mL/min que presentan los pacientes con función renal conservada."
Dilcoran_Plus_D__D5665-E-5330-01-Instruccion-Dilcoran-Plus-D-Uhlmann-600x200-1#0930,¿Qué efecto adverso se asocia con la exposición intrauterina a diuréticos tiazídicos como hidroclorotiazida?,ictericia o trombocitopenia fetal o neonatal,2,"['La exposición intrauterina a diuréticos tiazídicos, como hidroclorotiazida, se asocia con ictericia o trombocitopenia fetal o neonatal y puede asociarse con otras reacciones adversas registradas en los adultos.', 'En caso de embarazo durante la terapia, se debe suspender cuanto antes la administración de DILCORAN PLUS D.']","La exposición intrauterina a diuréticos tiazídicos, como hidroclorotiazida, se asocia con ictericia o trombocitopenia fetal o neonatal y puede asociarse con otras reacciones adversas registradas en los adultos. || En caso de embarazo durante la terapia, se debe suspender cuanto antes la administración de DILCORAN PLUS D."
Dilcoran_Plus__D2648-E-2326-01-Instruccion-Dilcoran-Plus#0945,¿Cuál es el efecto principal de la sobredosificación de valsartán en DILCORAN PLUS?,La hipotensión pronunciada con mareo es el principal síntoma de la sobredosificación de valsartán.,2,"['El principal síntoma de la sobredosificación de valsartán será probablemente la hipotensión pronunciada con mareo.', 'La hipotensión clínicamente significativa a causa de una sobredosis de DILCORAN PLUS exige un apoyo cardiovascular activo, incluida la monitorización asidua de la función cardiaca y respiratoria, la elevación de las extremidades, y atención al volumen de líquido circulante y la producción de orina.']","El principal síntoma de la sobredosificación de valsartán será probablemente la hipotensión pronunciada con mareo. || La hipotensión clínicamente significativa a causa de una sobredosis de DILCORAN PLUS exige un apoyo cardiovascular activo, incluida la monitorización asidua de la función cardiaca y respiratoria, la elevación de las extremidades, y atención al volumen de líquido circulante y la producción de orina."
Dilcoran__MKG-Instruccion-Dilcoran#0960,¿Cuál es el efecto principal del valsartán sobre la tensión arterial en pacientes con hipertensión?,reduce la tensión arterial sin afectar a la frecuencia cardíaca,3,"['La administración de valsartán a pacientes con hipertensión reduce la tensión arterial sin afectar a la frecuencia cardíaca.', 'Tras la administración de una dosis oral única, el efecto antihipertensivo ocurre en la mayoría de los individuos en un plazo de 2 horas y la máxima reducción de la tensión arterial se alcanza en 4 a 6 horas.', 'El efecto antihipertensor persiste más de 24 horas. Con tomas repetidas, la máxima reducción de la tensión arterial se alcanza generalmente en 2 a 4 semanas y se mantiene durante el tratamiento a largo plazo.']","La administración de valsartán a pacientes con hipertensión reduce la tensión arterial sin afectar a la frecuencia cardíaca. || Tras la administración de una dosis oral única, el efecto antihipertensivo ocurre en la mayoría de los individuos en un plazo de 2 horas y la máxima reducción de la tensión arterial se alcanza en 4 a 6 horas. || El efecto antihipertensor persiste más de 24 horas. Con tomas repetidas, la máxima reducción de la tensión arterial se alcanza generalmente en 2 a 4 semanas y se mantiene durante el tratamiento a largo plazo."
